{
  "schema_version": "0.1.0",
  "pair_id": "pair_03",
  "stratum": "Editor and terminal",
  "before_screen_id": "mac_0015",
  "after_screen_id": "mac_0016",
  "action_or_event_description": "User executed command at Terminal prompt, producing command line output and new shell prompt.",
  "changes": [
    {
      "track_id": "tr_0001",
      "before_node_id": "n_0000",
      "after_node_id": "n_0000",
      "change_type": "unchanged",
      "observable_evidence": [
        "Terminal window frame persisted with identical dimensions"
      ],
      "uncertainties": []
    },
    {
      "track_id": "tr_0002",
      "before_node_id": "n_0001",
      "after_node_id": "n_0001",
      "change_type": "unchanged",
      "observable_evidence": [
        "Title and tab strip remained unchanged"
      ],
      "uncertainties": []
    },
    {
      "track_id": "tr_0003",
      "before_node_id": null,
      "after_node_id": "n_0008",
      "change_type": "appeared",
      "observable_evidence": [
        "Terminal command execution output text appeared in console buffer"
      ],
      "uncertainties": []
    },
    {
      "track_id": "tr_0004",
      "before_node_id": "n_0007",
      "after_node_id": "n_0009",
      "change_type": "moved",
      "observable_evidence": [
        "Active command prompt and cursor repositioned beneath executed output"
      ],
      "uncertainties": []
    }
  ],
  "annotation_provenance": {
    "model_requested": "gemini-3.8-flash-antigravity",
    "model_returned": "gemini-3.8-flash-antigravity",
    "thinking_requested": "high",
    "prompt_version": "0.1.0",
    "human_reviewed": true
  }
}