{
  "schema_version": "0.1.0",
  "pair_id": "pair_05",
  "stratum": "Documents, PDFs and tables",
  "before_screen_id": "mac_0024",
  "after_screen_id": "mac_0025",
  "action_or_event_description": "User scrolled down / paginated from Page 1 to Page 2 of multi-page technical document in Preview.",
  "changes": [
    {
      "track_id": "tr_0001",
      "before_node_id": "n_0000",
      "after_node_id": "n_0000",
      "change_type": "unchanged",
      "observable_evidence": [
        "Preview application window remained stable in position and size"
      ],
      "uncertainties": []
    },
    {
      "track_id": "tr_0002",
      "before_node_id": "n_0001",
      "after_node_id": "n_0001",
      "change_type": "unchanged",
      "observable_evidence": [
        "Toolbar controls remained stationary"
      ],
      "uncertainties": []
    },
    {
      "track_id": "tr_0003",
      "before_node_id": "n_0003",
      "after_node_id": "n_0003",
      "change_type": "text_changed",
      "observable_evidence": [
        "Page 1 content scrolled out of primary view and Page 2 Overview content entered canvas"
      ],
      "uncertainties": []
    }
  ],
  "annotation_provenance": {
    "model_requested": "gemini-3.8-flash-antigravity",
    "model_returned": "gemini-3.8-flash-antigravity",
    "thinking_requested": "high",
    "prompt_version": "0.1.0",
    "human_reviewed": true
  }
}